{
  "$schema": "./branding.schema.json",
  "name": "Cascade",
  "shortName": "Cascade",
  "tagline": "Autonomous leak detection for every drop",
  "deviceName": "rig",
  "team": "",
  "school": "",
  "branches": ["Branch 1", "Branch 2", "Branch 3"],
  "colors": {
    "bg": "#0a1224",
    "accent": "#22d3ee",
    "ok": "#34d399",
    "warn": "#fbbf24",
    "danger": "#f43f5e"
  },
  "showQr": true
}
